{
  "contract_version": 1,
  "runner_surface_path": "mechanics/proof-infra/parts/reportable-contracts/runners/reportable_proof_contract.md",
  "inputs": [
    "starter-bundle dossier",
    "public chooser and index wording",
    "bundle-local evidence and report artifacts",
    "integrity risk classification notes",
    "anti-gaming taxonomy for false-pass and overclaim review"
  ],
  "scorer_helper_paths": [
    "mechanics/proof-infra/parts/reportable-contracts/scorers/bounded_rubric_breakdown.py"
  ],
  "report_schema_path": "evals/capability/aoa-eval-integrity-check/reports/summary.schema.json",
  "report_example_path": "evals/capability/aoa-eval-integrity-check/reports/example-report.json",
  "validation_commands": [
    "python scripts/validate_repo.py --eval aoa-eval-integrity-check"
  ]
}
