{
  "contract_version": 1,
  "runner_surface_path": "mechanics/proof-infra/parts/reportable-contracts/runners/reportable_proof_contract.md",
  "inputs": [
    "stats surface profile",
    "source coverage summary",
    "SDK re-grounding signal",
    "SDK routing advisory hint",
    "owner-local truth target",
    "consumer report wording"
  ],
  "fixture_contract_paths": [
    "evals/boundary/aoa-stats-regrounding-boundary-integrity/fixtures/contract.json"
  ],
  "scorer_helper_paths": [
    "mechanics/proof-infra/parts/reportable-contracts/scorers/bounded_rubric_breakdown.py"
  ],
  "report_schema_path": "evals/boundary/aoa-stats-regrounding-boundary-integrity/reports/summary.schema.json",
  "report_example_path": "evals/boundary/aoa-stats-regrounding-boundary-integrity/reports/example-report.json",
  "validation_commands": [
    "python scripts/validate_repo.py --eval aoa-stats-regrounding-boundary-integrity"
  ]
}
