{
  "contract_version": 1,
  "runner_surface_path": "mechanics/proof-infra/parts/reportable-contracts/runners/reportable_proof_contract.md",
  "inputs": [
    "compact local text case dossier",
    "one local text lane or API-compatible reply surface",
    "raw reply evidence for each case",
    "bounded contract readout for each case",
    "optional bounded latency notes"
  ],
  "fixture_contract_paths": [
    "evals/boundary/aoa-local-text-contract-fit/fixtures/contract.json"
  ],
  "scorer_helper_paths": [
    "mechanics/proof-infra/parts/reportable-contracts/scorers/bounded_rubric_breakdown.py"
  ],
  "report_schema_path": "evals/boundary/aoa-local-text-contract-fit/reports/summary.schema.json",
  "report_example_path": "evals/boundary/aoa-local-text-contract-fit/reports/example-report.json",
  "validation_commands": [
    "python scripts/validate_repo.py --eval aoa-local-text-contract-fit"
  ]
}
