{
  "contract_version": 1,
  "runner_surface_path": "evals/boundary/aoa-organ-access-admission-integrity/runners/run_scenarios.py",
  "inputs": [
    "one organ capability and policy plane",
    "exact owner and protocol pair",
    "source, package, deploy, and consumer-schema revisions",
    "sixteen independent maturity-axis states",
    "owner-qualified evidence, observation time, and freshness data for asserted axes",
    "optional exact SDK owner-result review for result grounding and freshness only",
    "optional exact stack-issued rollback-readiness candidate with immutable LKG target and no effect authority",
    "bounded result and limitations"
  ],
  "fixture_contract_paths": [
    "evals/boundary/aoa-organ-access-admission-integrity/fixtures/contract.json",
    "evals/boundary/aoa-organ-access-admission-integrity/schemas/organ-access-proof-packet.schema.json",
    "evals/boundary/aoa-organ-access-admission-integrity/schemas/rollback-readiness-candidate.schema.json",
    "evals/boundary/aoa-organ-access-admission-integrity/reports/rollback-review.schema.json"
  ],
  "scorer_helper_paths": [],
  "report_schema_path": "evals/boundary/aoa-organ-access-admission-integrity/reports/summary.schema.json",
  "report_example_path": "evals/boundary/aoa-organ-access-admission-integrity/reports/example-report.json",
  "validation_commands": [
    "python evals/boundary/aoa-organ-access-admission-integrity/runners/run_scenarios.py run-scenarios",
    "python evals/boundary/aoa-organ-access-admission-integrity/runners/review_rollback.py run-scenarios",
    "python -m pytest -q tests/test_organ_access_admission_integrity.py tests/test_organ_access_rollback_readiness.py",
    "python scripts/validate_repo.py --eval aoa-organ-access-admission-integrity"
  ]
}
