{
  "contract_version": 1,
  "runner_surface_path": "mechanics/proof-infra/parts/reportable-contracts/runners/reportable_proof_contract.md",
  "inputs": [
    "bounded ambiguity-bearing case dossier",
    "ambiguous task statement",
    "clarifications provided during the run",
    "observed handling move",
    "resulting execution surface",
    "final report",
    "bundle-level ambiguity summary"
  ],
  "fixture_contract_paths": [
    "evals/stress/aoa-ambiguity-handling/fixtures/contract.json"
  ],
  "scorer_helper_paths": [
    "mechanics/proof-infra/parts/reportable-contracts/scorers/bounded_rubric_breakdown.py"
  ],
  "report_schema_path": "evals/stress/aoa-ambiguity-handling/reports/summary.schema.json",
  "report_example_path": "evals/stress/aoa-ambiguity-handling/reports/example-report.json",
  "validation_commands": [
    "python scripts/validate_repo.py --eval aoa-ambiguity-handling"
  ]
}
