{
  "contract_version": 1,
  "runner_surface_path": "mechanics/proof-infra/parts/reportable-contracts/runners/reportable_proof_contract.md",
  "inputs": [
    "bounded change case dossier",
    "available verification path",
    "agent verification claims",
    "observed executed, skipped, and blocked checks",
    "bounded verification-honesty readout"
  ],
  "fixture_contract_paths": [
    "evals/workflow/aoa-verification-honesty/fixtures/contract.json"
  ],
  "scorer_helper_paths": [
    "mechanics/proof-infra/parts/reportable-contracts/scorers/bounded_rubric_breakdown.py"
  ],
  "report_schema_path": "evals/workflow/aoa-verification-honesty/reports/summary.schema.json",
  "report_example_path": "evals/workflow/aoa-verification-honesty/reports/example-report.json",
  "validation_commands": [
    "python scripts/validate_repo.py --eval aoa-verification-honesty"
  ]
}
