{
  "contract_version": 1,
  "runner_surface_path": "mechanics/recurrence/parts/control-plane-integrity/scripts/run_recurrence_control_plane_integrity_eval.py",
  "inputs": [
    "recurrence run dossier or fixture case json",
    "public-safe artifact summaries",
    "optional expected axis outcomes"
  ],
  "fixture_contract_paths": [
    "evals/boundary/aoa-recurrence-control-plane-integrity/fixtures/contract.json"
  ],
  "scorer_helper_paths": [
    "mechanics/recurrence/parts/control-plane-integrity/scorers/recurrence_control_plane_integrity.py"
  ],
  "report_schema_path": "evals/boundary/aoa-recurrence-control-plane-integrity/reports/summary.schema.json",
  "report_example_path": "evals/boundary/aoa-recurrence-control-plane-integrity/reports/example-report.json",
  "validation_commands": [
    "python mechanics/recurrence/parts/control-plane-integrity/scripts/run_recurrence_control_plane_integrity_eval.py --case mechanics/recurrence/parts/control-plane-integrity/fixtures/recurrence-control-plane-integrity-v1/cases/RCPI-001.registry-mixed-manifests.json --check-expected --json",
    "python -m unittest -q mechanics/recurrence/parts/control-plane-integrity/tests/test_recurrence_control_plane_integrity_eval_seed.py"
  ]
}
