{
  "contract_version": 1,
  "runner_surface_path": "mechanics/proof-infra/parts/reportable-contracts/runners/reportable_proof_contract.md",
  "inputs": [
    "reviewed candidate dossier",
    "bounded evidence refs",
    "chosen owner hypothesis",
    "owner shape note",
    "nearest wrong target note",
    "derivative repo exclusion note",
    "bundle-level routing summary"
  ],
  "fixture_contract_paths": [
    "bundles/aoa-owner-fit-routing-quality/fixtures/contract.json"
  ],
  "scorer_helper_paths": [
    "mechanics/proof-infra/parts/reportable-contracts/scorers/bounded_rubric_breakdown.py"
  ],
  "report_schema_path": "bundles/aoa-owner-fit-routing-quality/reports/summary.schema.json",
  "report_example_path": "bundles/aoa-owner-fit-routing-quality/reports/example-report.json",
  "validation_commands": [
    "python scripts/validate_repo.py --eval aoa-owner-fit-routing-quality"
  ]
}
